{
  "schemaVersion": "1.0.0",
  "executionRunId": "exec_PHASE14BRUN00000001",
  "executionRequestId": "execreq_PHASE14BREQ000001",
  "projectId": "proj_PHASE14BPROJECT0001",
  "artifactId": "art_PHASE14BARTIFACT0001",
  "workspaceId": "ws_PHASE14BWORKSPACE001",
  "providerId": "local-sandbox",
  "capability": "sandbox-execution",
  "status": "queued",
  "baseArtifactVersion": 1,
  "baseProjectStateVersion": 1,
  "inputSnapshotId": "snap_PHASE14BSNAP000001",
  "executionJobId": "execjob_PHASE14BJOB000001",
  "runtimeIdentity": {
    "runtimeKind": "process",
    "runtimeVersion": "process-runtime/1.0.0",
    "workspaceSnapshotId": "snap_PHASE14BSNAP000001",
    "workspaceManifestDigest": "sha256:aaaaaaaaaaaaaaaaaaaaaaaaaaaaaaaaaaaaaaaaaaaaaaaaaaaaaaaaaaaaaaaa",
    "commandSpecVersion": "1.0.0",
    "limits": {
      "wallTimeMs": 5000,
      "stdoutBytes": 65536,
      "stderrBytes": 65536,
      "totalLogBytes": 131072,
      "producedOutputBytes": 1048576,
      "outputFileCount": 8,
      "workspaceBytes": 16777216
    },
    "isolationGuarantees": [
      "no-inherited-env",
      "process-group-termination",
      "ephemeral-workspace"
    ],
    "isolationLimitations": [
      "no-network-isolation",
      "no-memory-cgroup",
      "host-process-isolation-only"
    ]
  },
  "startedAt": "2026-08-10T18:00:00Z",
  "outputReferences": [],
  "evidenceReferences": []
}
